{
  "$schema": "https://json-schema.org/draft/2020-12/schema",
  "$id": "https://wrapgod.dev/schemas/compatibility-report.v1.schema.json",
  "title": "WrapGod Compatibility Report v1",
  "type": "object",
  "additionalProperties": false,
  "required": [
    "schemaVersion",
    "package",
    "versionMatrix",
    "deltas"
  ],
  "properties": {
    "schemaVersion": { "const": "1.0" },
    "package": {
      "type": "object",
      "additionalProperties": false,
      "required": ["name", "versions"],
      "properties": {
        "name": { "type": "string", "minLength": 1 },
        "versions": {
          "type": "array",
          "minItems": 2,
          "items": { "type": "string", "minLength": 1 }
        }
      }
    },
    "versionMatrix": {
      "type": "object",
      "additionalProperties": false,
      "required": ["baseline", "latest"],
      "properties": {
        "baseline": { "type": "string", "minLength": 1 },
        "latest": { "type": "string", "minLength": 1 },
        "intermediate": {
          "type": "array",
          "items": { "type": "string", "minLength": 1 }
        }
      }
    },
    "summary": {
      "type": "object",
      "additionalProperties": false,
      "properties": {
        "totalDeltas": { "type": "integer", "minimum": 0 },
        "introducedMembers": { "type": "integer", "minimum": 0 },
        "removedMembers": { "type": "integer", "minimum": 0 },
        "changedMembers": { "type": "integer", "minimum": 0 }
      }
    },
    "deltas": {
      "type": "array",
      "minItems": 1,
      "items": {
        "type": "object",
        "additionalProperties": false,
        "required": [
          "id",
          "title",
          "severity",
          "migrationRecommendation",
          "members"
        ],
        "properties": {
          "id": { "type": "string", "pattern": "^delta-[0-9]+$" },
          "title": { "type": "string", "minLength": 1 },
          "severity": {
            "type": "string",
            "enum": ["safe", "review", "guided", "breaking", "manual"]
          },
          "migrationRecommendation": { "type": "string", "minLength": 1 },
          "notes": { "type": "string" },
          "members": {
            "type": "object",
            "additionalProperties": false,
            "required": ["introduced", "removed", "changed"],
            "properties": {
              "introduced": {
                "type": "array",
                "items": { "$ref": "#/$defs/memberRef" }
              },
              "removed": {
                "type": "array",
                "items": { "$ref": "#/$defs/memberRef" }
              },
              "changed": {
                "type": "array",
                "items": {
                  "allOf": [
                    { "$ref": "#/$defs/memberRef" },
                    {
                      "type": "object",
                      "required": ["changeSummary"]
                    }
                  ]
                }
              }
            }
          }
        }
      }
    }
  },
  "$defs": {
    "memberRef": {
      "type": "object",
      "additionalProperties": false,
      "required": ["kind", "displayName", "version"],
      "properties": {
        "kind": {
          "type": "string",
          "enum": ["type", "method", "property", "field", "event", "constructor"]
        },
        "displayName": { "type": "string", "minLength": 1 },
        "version": { "type": "string", "minLength": 1 },
        "changeSummary": { "type": "string", "minLength": 1 }
      }
    }
  }
}
